"DESCRIPTION","DURATION IN MS","NAME","PARENT SUITE","START TIME","STATUS","STOP TIME","SUB SUITE","SUITE","TEST CLASS","TEST METHOD"
"","2068","Verify that users cannot sign up with an already registered email address.","chromium","Wed May 14 14:02:20 GMT 2025","passed","Wed May 14 14:02:22 GMT 2025","SignupPage","MainAppPages/Signup.spec.js","",""
"","11608","Verify that widgets settings for Name, Job Title, Company, Text, and Email function correctly in Sign Yourself.","chromium","Wed May 14 14:05:04 GMT 2025","passed","Wed May 14 14:05:16 GMT 2025","Sign yourself","MainAppPages/SignYourSelf.spec.js","",""
"","12388","Verify that expired document is available on the Expired documents report.","chromium","Wed May 14 13:54:29 GMT 2025","passed","Wed May 14 13:54:41 GMT 2025","Expired documents","MainAppPages/ReportExpiredDoc.spec.js","",""
"","4743","Verify that a free user cannot access the Organisations page in the console application and is prompted to upgrade.","chromium","Wed May 14 13:46:53 GMT 2025","passed","Wed May 14 13:46:58 GMT 2025","Console app","ConsoleApp/ConsoleOrganisation.spec.js","",""
"","6445","Verify that textinput field widget Copy widget to all pages but last function correctly in request signature.","chromium","Wed May 14 14:00:43 GMT 2025","passed","Wed May 14 14:00:49 GMT 2025","Request signature","MainAppPages/Request_Signature.spec.js","",""
"","4209","Team plan user can access the Email page.","chromium","Wed May 14 13:46:45 GMT 2025","passed","Wed May 14 13:46:49 GMT 2025","Console app - Mail Page Access Validation","ConsoleApp/Consolemail.spec.js","",""
"","8100","Verify that signature widget Copy widget to all pages function correctly in Sign Yourself.","chromium","Wed May 14 14:03:13 GMT 2025","passed","Wed May 14 14:03:21 GMT 2025","Sign yourself","MainAppPages/SignYourSelf.spec.js","",""
"","3761","Verify that pagination is functioning correctly in the drafts document.","chromium","Wed May 14 13:54:25 GMT 2025","passed","Wed May 14 13:54:29 GMT 2025","","MainAppPages/ReportDraftdoc.spec.js","",""
"","37264","Verify that a user can sign up with a professional plan and validate the details in the user profile.","chromium","Wed May 14 14:01:12 GMT 2025","passed","Wed May 14 14:01:49 GMT 2025","SignupPage","MainAppPages/Signup.spec.js","",""
"","8444","Verify that initials widgets Copy widget next to current widget function correctly in Sign Yourself.","chromium","Wed May 14 14:04:56 GMT 2025","passed","Wed May 14 14:05:04 GMT 2025","Sign yourself","MainAppPages/SignYourSelf.spec.js","",""
"","18290","Verify that user cannot add a new contact with existing email address","chromium","Wed May 14 13:47:42 GMT 2025","passed","Wed May 14 13:48:00 GMT 2025","Contact","MainAppPages/Contact.spec.js","",""
"","4429","Verify that Team plan user can access the Signing certificate page in the console application and can upload the pfx certificate.","chromium","Wed May 14 13:47:12 GMT 2025","passed","Wed May 14 13:47:17 GMT 2025","Console app","ConsoleApp/ConsoleSignCertificate.spec.js","",""
"","12386","Verify that a Team Plan user can create a template, make it public, and sign the document through the public template.","chromium","Wed May 14 13:48:57 GMT 2025","passed","Wed May 14 13:49:10 GMT 2025","Templates","MainAppPages/CreateTemplate.spec.js","",""
"","4126","Verify that Professional plan user cannot access the Signing certificate page in the console application and is prompted to upgrade Team plan.","chromium","Wed May 14 13:47:08 GMT 2025","passed","Wed May 14 13:47:12 GMT 2025","Console app","ConsoleApp/ConsoleSignCertificate.spec.js","",""
"","5699","Verify that the delete page functions correctly in Sign Yourself.","chromium","Wed May 14 14:06:26 GMT 2025","passed","Wed May 14 14:06:31 GMT 2025","Sign yourself","MainAppPages/SignYourSelf.spec.js","",""
"","16072","Verify that revoked document from the In Progress document is available on the declined documents report.","chromium","Wed May 14 13:53:45 GMT 2025","passed","Wed May 14 13:54:01 GMT 2025","Declined documents","MainAppPages/ReportDeclineddoc.spec.js","",""
"","18378","Verify admin user can add the team user if user has teams plan.","chromium","Wed May 14 14:06:51 GMT 2025","passed","Wed May 14 14:07:09 GMT 2025","","MainAppPages/TeamUsers.spec.js","",""
"","4425","Profession plan user is prompted to upgrade when accessing the Branding page.","chromium","Wed May 14 13:46:25 GMT 2025","passed","Wed May 14 13:46:30 GMT 2025","Console app - Branding Access Validation","ConsoleApp/ConsoleBranding.spec.js","",""
"","9776","Verify the column names and the document details on the inprogress report.","chromium","Wed May 14 13:54:55 GMT 2025","passed","Wed May 14 13:55:05 GMT 2025","Inprogress report","MainAppPages/ReportInprogrees.spec.js","",""
"","9865","Verify that pagination is functioning correctly in the Teams user table.","chromium","Wed May 14 14:07:13 GMT 2025","passed","Wed May 14 14:07:23 GMT 2025","","MainAppPages/TeamUsers.spec.js","",""
"","5780","Verify that textinput field widget Copy widget to all pages but first function correctly in request signature.","chromium","Wed May 14 14:00:49 GMT 2025","passed","Wed May 14 14:00:55 GMT 2025","Request signature","MainAppPages/Request_Signature.spec.js","",""
"","14679","Verify that existing user can perform the sign yourself","chromium","Wed May 14 14:02:36 GMT 2025","passed","Wed May 14 14:02:51 GMT 2025","Sign yourself","MainAppPages/SignYourSelf.spec.js","",""
"","10533","Verify that the rotate page functions correctly in create template.","chromium","Wed May 14 13:49:32 GMT 2025","passed","Wed May 14 13:49:42 GMT 2025","Templates","MainAppPages/CreateTemplate.spec.js","",""
"","12446","Verify that new user can create and send the document for request signature.","chromium","Wed May 14 13:56:21 GMT 2025","passed","Wed May 14 13:56:34 GMT 2025","Request signature","MainAppPages/Request_Signature.spec.js","",""
"","4067","Verify that a new free user cannot add a team user and is prompted to upgrade to the Teams plan.","chromium","Wed May 14 14:07:09 GMT 2025","passed","Wed May 14 14:07:13 GMT 2025","","MainAppPages/TeamUsers.spec.js","",""
"","5865","Verify that signature widgets Copy widget to all pages but last function correctly in request signature.","chromium","Wed May 14 13:58:49 GMT 2025","passed","Wed May 14 13:58:55 GMT 2025","Request signature","MainAppPages/Request_Signature.spec.js","",""
"","6991","Verify that text widget Copy widget next to current widget function correctly in request signature.","chromium","Wed May 14 14:00:29 GMT 2025","passed","Wed May 14 14:00:36 GMT 2025","Request signature","MainAppPages/Request_Signature.spec.js","",""
"","12319","Verify that the user can sign a document of type Image.","chromium","Wed May 14 14:02:51 GMT 2025","passed","Wed May 14 14:03:03 GMT 2025","Sign yourself","MainAppPages/SignYourSelf.spec.js","",""
"","4353","Verify that Professional plan user cannot access the Storage page in the console application and is prompted to upgrade Team plan.","chromium","Wed May 14 13:47:21 GMT 2025","passed","Wed May 14 13:47:25 GMT 2025","Console app","ConsoleApp/ConsoleStorage.spec.js","",""
"","13039","Verify that user can perform the sign yourself using the word document","chromium","Wed May 14 13:52:50 GMT 2025","passed","Wed May 14 13:53:03 GMT 2025","Incompatiblepdfs","MainAppPages/pdfsCompatibility.spec.js","",""
"","10901","Verify that the user can successfully sign a PDF that was previously incompatible pdf 10pages.","chromium","Wed May 14 13:52:28 GMT 2025","passed","Wed May 14 13:52:39 GMT 2025","Incompatiblepdfs","MainAppPages/pdfsCompatibility.spec.js","",""
"","14213","Verify that the Need Your Signature count on the card increases when a new document is created and the owner is added as a signer.","chromium","Wed May 14 13:49:57 GMT 2025","passed","Wed May 14 13:50:12 GMT 2025","Dashboard","MainAppPages/Dashboard.spec.js","",""
"","8422","Verify that the tour guide messages not displayed for an existing signer when the tour guide is set to disabled.","chromium","Wed May 14 13:57:51 GMT 2025","passed","Wed May 14 13:58:00 GMT 2025","Request signature","MainAppPages/Request_Signature.spec.js","",""
"","8288","Verify that signature widgets Copy widget to all pages but first function correctly in Sign Yourself.","chromium","Wed May 14 14:03:29 GMT 2025","passed","Wed May 14 14:03:38 GMT 2025","Sign yourself","MainAppPages/SignYourSelf.spec.js","",""
"","8609","Verify that a new free user cannot access the paid features on the request signature page.","chromium","Wed May 14 13:57:43 GMT 2025","passed","Wed May 14 13:57:51 GMT 2025","Request signature","MainAppPages/Request_Signature.spec.js","",""
"","5137","Verify that New free user can save the general preferences.","chromium","Wed May 14 13:53:03 GMT 2025","passed","Wed May 14 13:53:08 GMT 2025","Preferences","MainAppPages/Preferences.spec.js","",""
"","5678","Verify that the Sign yourself card click functions correctly and redirects the user to the Signyourself page from the dashboard.","chromium","Wed May 14 13:49:42 GMT 2025","passed","Wed May 14 13:49:48 GMT 2025","Dashboard","MainAppPages/Dashboard.spec.js","",""
"","7731","Verify that the rotate page functions correctly in request signature.","chromium","Wed May 14 13:58:36 GMT 2025","passed","Wed May 14 13:58:43 GMT 2025","Request signature","MainAppPages/Request_Signature.spec.js","",""
"","9703","Verify that text widget Copy widget to all pages but last function correctly in Sign Yourself.","chromium","Wed May 14 14:05:41 GMT 2025","passed","Wed May 14 14:05:51 GMT 2025","Sign yourself","MainAppPages/SignYourSelf.spec.js","",""
"","13448","Verify that the rotate page functions correctly in Sign Yourself.","chromium","Wed May 14 14:06:31 GMT 2025","passed","Wed May 14 14:06:45 GMT 2025","Sign yourself","MainAppPages/SignYourSelf.spec.js","",""
"","9959","Verify that name,job title, company, checkbox, image and email widgets Copy function correctly in Sign Yourself.","chromium","Wed May 14 14:05:16 GMT 2025","passed","Wed May 14 14:05:26 GMT 2025","Sign yourself","MainAppPages/SignYourSelf.spec.js","",""
"","6810","Verify that text widget Copy widget to all pages but first function correctly in request signature.","chromium","Wed May 14 14:00:22 GMT 2025","passed","Wed May 14 14:00:29 GMT 2025","Request signature","MainAppPages/Request_Signature.spec.js","",""
"","6554","Verify that the signature settings function correctly for the signature widget on the request signature page.","chromium","Wed May 14 13:58:16 GMT 2025","passed","Wed May 14 13:58:23 GMT 2025","Request signature","MainAppPages/Request_Signature.spec.js","",""
"","8288","Verify that initials widgets Copy widget to all pages function correctly in Sign Yourself.","chromium","Wed May 14 14:04:30 GMT 2025","passed","Wed May 14 14:04:39 GMT 2025","Sign yourself","MainAppPages/SignYourSelf.spec.js","",""
"","29329","Verify that a user can create a document with two signers, send it for a signature request, and signer can successfully sign the document.","chromium","Wed May 14 13:57:13 GMT 2025","passed","Wed May 14 13:57:43 GMT 2025","Request signature","MainAppPages/Request_Signature.spec.js","",""
